Sheet: Sheet1
B3: OR gate inputs | D3: Output
B4: A | C4: B
B5: 0 | C5: 0 | D5: 0
B6: 0 | C6: 1 | D6: 1
B7: 1 | C7: 0 | D7: 1
B8: 1 | C8: 1 | D8: 1
A10: Iteration 1 | B10: w1 | C10: w2 | D10: w3 | E10: bias | F10: Learning rate | K10: MSE calculated
B11: 0.2 | C11: 0.3 | D11: 0.5 | E11: 1 | F11: 0.5 | K11: of:=SUM([.K14:.K17]) -> 0.333000142009796
B13: A | C13: B | D13: Target O | E13: w1 | F13: w2 | G13: w3 | H13: bias | I13: Input Agg | J13: Predicted O | K13: MSE term | L13: ∂(error)/∂(O) | M13: ∂(O)/∂(in) | N13: ∂(in)/∂(w1) | O13: ∂(in)/∂(w2) | P13: ∂(in)/∂(w2) | Q13: ∂(error)/∂(w1) | R13: ∂(error)/∂(w2) | S13: ∂(error)/∂(w3) | T13: Learning rate | U13: New w1 | V13: New w2 | W13: New w3
B14: of:=[.B5] -> 0 | C14: of:=[.C5] -> 0 | D14: of:=[.D5] -> 0 | E14: of:=[.B11] -> 0.2 | F14: of:=[.C11] -> 0.3 | G14: of:=[.D11] -> 0.5 | H14: of:=[.E11] -> 1 | I14: of:=([.E14]*[.B14])+([.F14]*[.C14])+([.G14]*[.H14]) -> 0.5 | J14: of:=1/(1+EXP(-1*[.I14])) -> 0.622459331201855 | K14: of:=0.5*([.D14]-[.J14])*([.D14]-[.J14]) -> 0.19372780950013 | L14: of:=[.J14]-[.D14] -> 0.622459331201855 | M14: of:=[.J14]*(1-[.J14]) -> 0.235003712201594 | N14: of:=[.B14] -> 0 | O14: of:=[.C14] -> 0 | P14: of:=[.H14] -> 1 | Q14: of:=[.L14]*[.M14]*[.N14] -> 0 | R14: of:=[.L14]*[.M14]*[.O14] -> 0 | S14: of:=[.L14]*[.M14]*[.P14] -> 0.146280253526958 | T14: of:=[.F11] -> 0.5 | W14: of:=[.G14]-([.T14]*[.S14]) -> 0.426859873236521
B15: of:=[.B6] -> 0 | C15: of:=[.C6] -> 1 | D15: of:=[.D6] -> 1 | E15: of:=[.E14] -> 0.2 | F15: of:=[.F14] -> 0.3 | G15: of:=[.G14] -> 0.5 | H15: of:=[.H14] -> 1 | I15: of:=([.E15]*[.B15])+([.F15]*[.C15])+([.G15]*[.H15]) -> 0.8 | J15: of:=1/(1+EXP(-1*[.I15])) -> 0.689974481127612 | K15: of:=0.5*([.D15]-[.J15])*([.D15]-[.J15]) -> 0.0480579111760466 | L15: of:=[.J15]-[.D15] -> -0.310025518872387 | M15: of:=[.J15]*(1-[.J15]) -> 0.213909696520294 | N15: of:=[.B15] -> 0 | O15: of:=[.C15] -> 1 | P15: of:=[.H15] -> 1 | Q15: of:=[.L15]*[.M15]*[.N15] -> -0 | R15: of:=[.L15]*[.M15]*[.O15] -> -0.0663174646555392 | S15: of:=[.S14] -> 0.146280253526958 | T15: of:=[.T14] -> 0.5 | V15: of:=[.F15]-([.T15]*[.R15]) -> 0.33315873232777
B16: of:=[.B7] -> 1 | C16: of:=[.C7] -> 0 | D16: of:=[.D7] -> 1 | E16: of:=[.E15] -> 0.2 | F16: of:=[.F15] -> 0.3 | G16: of:=[.G15] -> 0.5 | H16: of:=[.H15] -> 1 | I16: of:=([.E16]*[.B16])+([.F16]*[.C16])+([.G16]*[.H16]) -> 0.7 | J16: of:=1/(1+EXP(-1*[.I16])) -> 0.668187772168166 | K16: of:=0.5*([.D16]-[.J16])*([.D16]-[.J16]) -> 0.0550496772693624 | L16: of:=[.J16]-[.D16] -> -0.331812227831834 | M16: of:=[.J16]*(1-[.J16]) -> 0.221712873293109 | N16: of:=[.B16] -> 1 | O16: of:=[.C16] -> 0 | P16: of:=[.H16] -> 1 | Q16: of:=[.L16]*[.M16]*[.N16] -> -0.0735670424263836 | R16: of:=[.L16]*[.M16]*[.O16] -> -0 | S16: of:=[.S15] -> 0.146280253526958 | T16: of:=[.T15] -> 0.5 | U16: of:=[.E16]-([.T16]*[.Q16]) -> 0.236783521213192
B17: of:=[.B8] -> 1 | C17: of:=[.C8] -> 1 | D17: of:=[.D8] -> 1 | E17: of:=[.E16] -> 0.2 | F17: of:=[.F16] -> 0.3 | G17: of:=[.G16] -> 0.5 | H17: of:=[.H16] -> 1 | I17: of:=([.E17]*[.B17])+([.F17]*[.C17])+([.G17]*[.H17]) -> 1 | J17: of:=1/(1+EXP(-1*[.I17])) -> 0.731058578630005 | K17: of:=0.5*([.D17]-[.J17])*([.D17]-[.J17]) -> 0.0361647440642566 | L17: of:=[.J17]-[.D17] -> -0.268941421369995 | M17: of:=[.J17]*(1-[.J17]) -> 0.196611933241482 | N17: of:=[.B17] -> 1 | O17: of:=[.C17] -> 1 | P17: of:=[.H17] -> 1 | Q17: of:=[.L17]*[.M17]*[.N17] -> -0.0528770927842667 | R17: of:=[.L17]*[.M17]*[.O17] -> -0.0528770927842667 | S17: of:=[.S16] -> 0.146280253526958 | T17: of:=[.T16] -> 0.5
A19: Iteration 2 | B19: w1 | C19: w2 | D19: w3 | E19: bias | F19: Learning rate | K19: MSE calculated
B20: of:=[.U16] -> 0.236783521213192 | C20: of:=[.V15] -> 0.33315873232777 | D20: of:=[.W14] -> 0.426859873236521 | E20: 1 | F20: of:=[.F11] -> 0.5 | K20: of:=SUM([.K23:.K26]) -> 0.327961236635991
B22: A | C22: B | D22: Target O | E22: w1 | F22: w2 | G22: w3 | H22: bias | I22: Input Agg | J22: Predicted O | K22: MSE term | L22: ∂(error)/∂(O) | M22: ∂(O)/∂(in) | N22: ∂(in)/∂(w1) | O22: ∂(in)/∂(w2) | P22: ∂(in)/∂(w2) | Q22: ∂(error)/∂(w1) | R22: ∂(error)/∂(w2) | S22: ∂(error)/∂(w3) | T22: Learning rate | U22: New w1 | V22: New w2 | W22: New w3
B23: of:=[.B14] -> 0 | C23: of:=[.C14] -> 0 | D23: of:=[.D14] -> 0 | E23: of:=[.U16] -> 0.236783521213192 | F23: of:=[.C20] -> 0.33315873232777 | G23: of:=[.D20] -> 0.426859873236521 | H23: of:=[.E20] -> 1 | I23: of:=([.E23]*[.B23])+([.F23]*[.C23])+([.G23]*[.H23]) -> 0.426859873236521 | J23: of:=1/(1+EXP(-1*[.I23])) -> 0.605123586402043 | K23: of:=0.5*([.D23]-[.J23])*([.D23]-[.J23]) -> 0.183087277410036 | L23: of:=[.J23]-[.D23] -> 0.605123586402043 | M23: of:=[.J23]*(1-[.J23]) -> 0.238949031581972 | N23: of:=[.B23] -> 0 | O23: of:=[.C23] -> 0 | P23: of:=[.H23] -> 1 | Q23: of:=[.L23]*[.M23]*[.N23] -> 0 | R23: of:=[.L23]*[.M23]*[.O23] -> 0 | S23: of:=[.L23]*[.M23]*[.P23] -> 0.144593694958178 | T23: of:=[.F20] -> 0.5 | W23: of:=[.G23]-([.T23]*[.S23]) -> 0.354563025757432
B24: of:=[.B15] -> 0 | C24: of:=[.C15] -> 1 | D24: of:=[.D15] -> 1 | E24: of:=[.E23] -> 0.236783521213192 | F24: of:=[.F23] -> 0.33315873232777 | G24: of:=[.G23] -> 0.426859873236521 | H24: of:=[.H23] -> 1 | I24: of:=([.E24]*[.B24])+([.F24]*[.C24])+([.G24]*[.H24]) -> 0.760018605564291 | J24: of:=1/(1+EXP(-1*[.I24])) -> 0.681357773244776 | K24: of:=0.5*([.D24]-[.J24])*([.D24]-[.J24]) -> 0.0507664343357639 | L24: of:=[.J24]-[.D24] -> -0.318642226755224 | M24: of:=[.J24]*(1-[.J24]) -> 0.217109358083697 | N24: of:=[.B24] -> 0 | O24: of:=[.C24] -> 1 | P24: of:=[.H24] -> 1 | Q24: of:=[.L24]*[.M24]*[.N24] -> -0 | R24: of:=[.L24]*[.M24]*[.O24] -> -0.0691802093091864 | S24: of:=[.S23] -> 0.144593694958178 | T24: of:=[.T23] -> 0.5 | V24: of:=[.F24]-([.T24]*[.R24]) -> 0.367748836982363
B25: of:=[.B16] -> 1 | C25: of:=[.C16] -> 0 | D25: of:=[.D16] -> 1 | E25: of:=[.E24] -> 0.236783521213192 | F25: of:=[.F24] -> 0.33315873232777 | G25: of:=[.G24] -> 0.426859873236521 | H25: of:=[.H24] -> 1 | I25: of:=([.E25]*[.B25])+([.F25]*[.C25])+([.G25]*[.H25]) -> 0.663643394449713 | J25: of:=1/(1+EXP(-1*[.I25])) -> 0.66007835094952 | K25: of:=0.5*([.D25]-[.J25])*([.D25]-[.J25]) -> 0.0577733637465989 | L25: of:=[.J25]-[.D25] -> -0.33992164905048 | M25: of:=[.J25]*(1-[.J25]) -> 0.224374921557282 | N25: of:=[.B25] -> 1 | O25: of:=[.C25] -> 0 | P25: of:=[.H25] -> 1 | Q25: of:=[.L25]*[.M25]*[.N25] -> -0.0762698933413236 | R25: of:=[.L25]*[.M25]*[.O25] -> -0 | S25: of:=[.S24] -> 0.144593694958178 | T25: of:=[.T24] -> 0.5 | U25: of:=[.E25]-([.T25]*[.Q25]) -> 0.274918467883854
B26: of:=[.B17] -> 1 | C26: of:=[.C17] -> 1 | D26: of:=[.D17] -> 1 | E26: of:=[.E25] -> 0.236783521213192 | F26: of:=[.F25] -> 0.33315873232777 | G26: of:=[.G25] -> 0.426859873236521 | H26: of:=[.H25] -> 1 | I26: of:=([.E26]*[.B26])+([.F26]*[.C26])+([.G26]*[.H26]) -> 0.996802126777483 | J26: of:=1/(1+EXP(-1*[.I26])) -> 0.730429374213019 | K26: of:=0.5*([.D26]-[.J26])*([.D26]-[.J26]) -> 0.0363341611435922 | L26: of:=[.J26]-[.D26] -> -0.269570625786981 | M26: of:=[.J26]*(1-[.J26]) -> 0.196902303499796 | N26: of:=[.B26] -> 1 | O26: of:=[.C26] -> 1 | P26: of:=[.H26] -> 1 | Q26: of:=[.L26]*[.M26]*[.N26] -> -0.0530790771733382 | R26: of:=[.L26]*[.M26]*[.O26] -> -0.0530790771733382 | S26: of:=[.S25] -> 0.144593694958178 | T26: of:=[.T25] -> 0.5
A28: Iteration 3 | B28: w1 | C28: w2 | D28: w3 | E28: bias | F28: Learning rate | K28: MSE calculated
B29: of:=[.U25] -> 0.274918467883854 | C29: of:=[.V24] -> 0.367748836982363 | D29: of:=[.W23] -> 0.354563025757432 | E29: 1 | F29: of:=[.F20] -> 0.5 | K29: of:=SUM([.K32:.K35]) -> 0.322870250198594
B31: A | C31: B | D31: Target O | E31: w1 | F31: w2 | G31: w3 | H31: bias | I31: Input Agg | J31: Predicted O | K31: MSE term | L31: ∂(error)/∂(O) | M31: ∂(O)/∂(in) | N31: ∂(in)/∂(w1) | O31: ∂(in)/∂(w2) | P31: ∂(in)/∂(w2) | Q31: ∂(error)/∂(w1) | R31: ∂(error)/∂(w2) | S31: ∂(error)/∂(w3) | T31: Learning rate | U31: New w1 | V31: New w2 | W31: New w3
B32: of:=[.B23] -> 0 | C32: of:=[.C23] -> 0 | D32: of:=[.D23] -> 0 | E32: of:=[.U25] -> 0.274918467883854 | F32: of:=[.C29] -> 0.367748836982363 | G32: of:=[.D29] -> 0.354563025757432 | H32: of:=[.E29] -> 1 | I32: of:=([.E32]*[.B32])+([.F32]*[.C32])+([.G32]*[.H32]) -> 0.354563025757432 | J32: of:=1/(1+EXP(-1*[.I32])) -> 0.587723661691551 | K32: of:=0.5*([.D32]-[.J32])*([.D32]-[.J32]) -> 0.172709551256062 | L32: of:=[.J32]-[.D32] -> 0.587723661691551 | M32: of:=[.J32]*(1-[.J32]) -> 0.242304559179426 | N32: of:=[.B32] -> 0 | O32: of:=[.C32] -> 0 | P32: of:=[.H32] -> 1 | Q32: of:=[.L32]*[.M32]*[.N32] -> 0 | R32: of:=[.L32]*[.M32]*[.O32] -> 0 | S32: of:=[.L32]*[.M32]*[.P32] -> 0.14240812276549 | T32: of:=[.F29] -> 0.5 | W32: of:=[.G32]-([.T32]*[.S32]) -> 0.283358964374687
B33: of:=[.B24] -> 0 | C33: of:=[.C24] -> 1 | D33: of:=[.D24] -> 1 | E33: of:=[.E32] -> 0.274918467883854 | F33: of:=[.F32] -> 0.367748836982363 | G33: of:=[.G32] -> 0.354563025757432 | H33: of:=[.H32] -> 1 | I33: of:=([.E33]*[.B33])+([.F33]*[.C33])+([.G33]*[.H33]) -> 0.722311862739795 | J33: of:=1/(1+EXP(-1*[.I33])) -> 0.673115901710675 | K33: of:=0.5*([.D33]-[.J33])*([.D33]-[.J33]) -> 0.0534266068572126 | L33: of:=[.J33]-[.D33] -> -0.326884098289325 | M33: of:=[.J33]*(1-[.J33]) -> 0.2200308845749 | N33: of:=[.B33] -> 0 | O33: of:=[.C33] -> 1 | P33: of:=[.H33] -> 1 | Q33: of:=[.L33]*[.M33]*[.N33] -> -0 | R33: of:=[.L33]*[.M33]*[.O33] -> -0.0719245973000687 | S33: of:=[.S32] -> 0.14240812276549 | T33: of:=[.T32] -> 0.5 | V33: of:=[.F33]-([.T33]*[.R33]) -> 0.403711135632397
B34: of:=[.B25] -> 1 | C34: of:=[.C25] -> 0 | D34: of:=[.D25] -> 1 | E34: of:=[.E33] -> 0.274918467883854 | F34: of:=[.F33] -> 0.367748836982363 | G34: of:=[.G33] -> 0.354563025757432 | H34: of:=[.H33] -> 1 | I34: of:=([.E34]*[.B34])+([.F34]*[.C34])+([.G34]*[.H34]) -> 0.629481493641286 | J34: of:=1/(1+EXP(-1*[.I34])) -> 0.652371883156174 | K34: of:=0.5*([.D34]-[.J34])*([.D34]-[.J34]) -> 0.0604226538101924 | L34: of:=[.J34]-[.D34] -> -0.347628116843826 | M34: of:=[.J34]*(1-[.J34]) -> 0.226782809223441 | N34: of:=[.B34] -> 1 | O34: of:=[.C34] -> 0 | P34: of:=[.H34] -> 1 | Q34: of:=[.L34]*[.M34]*[.N34] -> -0.0788360809028975 | R34: of:=[.L34]*[.M34]*[.O34] -> -0 | S34: of:=[.S33] -> 0.14240812276549 | T34: of:=[.T33] -> 0.5 | U34: of:=[.E34]-([.T34]*[.Q34]) -> 0.314336508335302
B35: of:=[.B26] -> 1 | C35: of:=[.C26] -> 1 | D35: of:=[.D26] -> 1 | E35: of:=[.E34] -> 0.274918467883854 | F35: of:=[.F34] -> 0.367748836982363 | G35: of:=[.G34] -> 0.354563025757432 | H35: of:=[.H34] -> 1 | I35: of:=([.E35]*[.B35])+([.F35]*[.C35])+([.G35]*[.H35]) -> 0.997230330623649 | J35: of:=1/(1+EXP(-1*[.I35])) -> 0.730513680216872 | K35: of:=0.5*([.D35]-[.J35])*([.D35]-[.J35]) -> 0.036311438275127 | L35: of:=[.J35]-[.D35] -> -0.269486319783128 | M35: of:=[.J35]*(1-[.J35]) -> 0.196863443232873 | N35: of:=[.B35] -> 1 | O35: of:=[.C35] -> 1 | P35: of:=[.H35] -> 1 | Q35: of:=[.L35]*[.M35]*[.N35] -> -0.0530520048166617 | R35: of:=[.L35]*[.M35]*[.O35] -> -0.0530520048166617 | S35: of:=[.S34] -> 0.14240812276549 | T35: of:=[.T34] -> 0.5
A37: Iteration 4 | B37: w1 | C37: w2 | D37: w3 | E37: bias | F37: Learning rate | K37: MSE calculated
B38: of:=[.U34] -> 0.314336508335302 | C38: of:=[.V33] -> 0.403711135632397 | D38: of:=[.W32] -> 0.283358964374687 | E38: 1 | F38: of:=[.F29] -> 0.5 | K38: of:=SUM([.K41:.K44]) -> 0.317724957819581
B40: A | C40: B | D40: Target O | E40: w1 | F40: w2 | G40: w3 | H40: bias | I40: Input Agg | J40: Predicted O | K40: MSE term | L40: ∂(error)/∂(O) | M40: ∂(O)/∂(in) | N40: ∂(in)/∂(w1) | O40: ∂(in)/∂(w2) | P40: ∂(in)/∂(w2) | Q40: ∂(error)/∂(w1) | R40: ∂(error)/∂(w2) | S40: ∂(error)/∂(w3) | T40: Learning rate | U40: New w1 | V40: New w2 | W40: New w3
B41: of:=[.B32] -> 0 | C41: of:=[.C32] -> 0 | D41: of:=[.D32] -> 0 | E41: of:=[.U34] -> 0.314336508335302 | F41: of:=[.C38] -> 0.403711135632397 | G41: of:=[.D38] -> 0.283358964374687 | H41: of:=[.E38] -> 1 | I41: of:=([.E41]*[.B41])+([.F41]*[.C41])+([.G41]*[.H41]) -> 0.283358964374687 | J41: of:=1/(1+EXP(-1*[.I41])) -> 0.570369525706193 | K41: of:=0.5*([.D41]-[.J41])*([.D41]-[.J41]) -> 0.162660697927154 | L41: of:=[.J41]-[.D41] -> 0.570369525706193 | M41: of:=[.J41]*(1-[.J41]) -> 0.245048129851885 | N41: of:=[.B41] -> 0 | O41: of:=[.C41] -> 0 | P41: of:=[.H41] -> 1 | Q41: of:=[.L41]*[.M41]*[.N41] -> 0 | R41: of:=[.L41]*[.M41]*[.O41] -> 0 | S41: of:=[.L41]*[.M41]*[.P41] -> 0.13976798559881 | T41: of:=[.F38] -> 0.5 | W41: of:=[.G41]-([.T41]*[.S41]) -> 0.213474971575283
B42: of:=[.B33] -> 0 | C42: of:=[.C33] -> 1 | D42: of:=[.D33] -> 1 | E42: of:=[.E41] -> 0.314336508335302 | F42: of:=[.F41] -> 0.403711135632397 | G42: of:=[.G41] -> 0.283358964374687 | H42: of:=[.H41] -> 1 | I42: of:=([.E42]*[.B42])+([.F42]*[.C42])+([.G42]*[.H42]) -> 0.687070100007085 | J42: of:=1/(1+EXP(-1*[.I42])) -> 0.665314839287956 | K42: of:=0.5*([.D42]-[.J42])*([.D42]-[.J42]) -> 0.0560070784004234 | L42: of:=[.J42]-[.D42] -> -0.334685160712044 | M42: of:=[.J42]*(1-[.J42]) -> 0.222671003911197 | N42: of:=[.B42] -> 0 | O42: of:=[.C42] -> 1 | P42: of:=[.H42] -> 1 | Q42: of:=[.L42]*[.M42]*[.N42] -> -0 | R42: of:=[.L42]*[.M42]*[.O42] -> -0.0745246807299313 | S42: of:=[.S41] -> 0.13976798559881 | T42: of:=[.T41] -> 0.5 | V42: of:=[.F42]-([.T42]*[.R42]) -> 0.440973475997363
B43: of:=[.B34] -> 1 | C43: of:=[.C34] -> 0 | D43: of:=[.D34] -> 1 | E43: of:=[.E42] -> 0.314336508335302 | F43: of:=[.F42] -> 0.403711135632397 | G43: of:=[.G42] -> 0.283358964374687 | H43: of:=[.H42] -> 1 | I43: of:=([.E43]*[.B43])+([.F43]*[.C43])+([.G43]*[.H43]) -> 0.59769547270999 | J43: of:=1/(1+EXP(-1*[.I43])) -> 0.645128889896281 | K43: of:=0.5*([.D43]-[.J43])*([.D43]-[.J43]) -> 0.0629667523931228 | L43: of:=[.J43]-[.D43] -> -0.354871110103719 | M43: of:=[.J43]*(1-[.J43]) -> 0.228937605317473 | N43: of:=[.B43] -> 1 | O43: of:=[.C43] -> 0 | P43: of:=[.H43] -> 1 | Q43: of:=[.L43]*[.M43]*[.N43] -> -0.0812433421434987 | R43: of:=[.L43]*[.M43]*[.O43] -> -0 | S43: of:=[.S42] -> 0.13976798559881 | T43: of:=[.T42] -> 0.5 | U43: of:=[.E43]-([.T43]*[.Q43]) -> 0.354958179407052
B44: of:=[.B35] -> 1 | C44: of:=[.C35] -> 1 | D44: of:=[.D35] -> 1 | E44: of:=[.E43] -> 0.314336508335302 | F44: of:=[.F43] -> 0.403711135632397 | G44: of:=[.G43] -> 0.283358964374687 | H44: of:=[.H43] -> 1 | I44: of:=([.E44]*[.B44])+([.F44]*[.C44])+([.G44]*[.H44]) -> 1.00140660834239 | J44: of:=1/(1+EXP(-1*[.I44])) -> 0.731335044715987 | K44: of:=0.5*([.D44]-[.J44])*([.D44]-[.J44]) -> 0.0360904290988805 | L44: of:=[.J44]-[.D44] -> -0.268664955284013 | M44: of:=[.J44]*(1-[.J44]) -> 0.196484097086253 | N44: of:=[.B44] -> 1 | O44: of:=[.C44] -> 1 | P44: of:=[.H44] -> 1 | Q44: of:=[.L44]*[.M44]*[.N44] -> -0.0527883911576978 | R44: of:=[.L44]*[.M44]*[.O44] -> -0.0527883911576978 | S44: of:=[.S43] -> 0.13976798559881 | T44: of:=[.T43] -> 0.5
A46: Iteration 5 | B46: w1 | C46: w2 | D46: w3 | E46: bias | F46: Learning rate | K46: MSE calculated
B47: of:=[.U43] -> 0.354958179407052 | C47: of:=[.V42] -> 0.440973475997363 | D47: of:=[.W41] -> 0.213474971575283 | E47: 1 | F47: of:=[.F38] -> 0.5 | K47: of:=SUM([.K50:.K53]) -> 0.312521534803847
B49: A | C49: B | D49: Target O | E49: w1 | F49: w2 | G49: w3 | H49: bias | I49: Input Agg | J49: Predicted O | K49: MSE term | L49: ∂(error)/∂(O) | M49: ∂(O)/∂(in) | N49: ∂(in)/∂(w1) | O49: ∂(in)/∂(w2) | P49: ∂(in)/∂(w2) | Q49: ∂(error)/∂(w1) | R49: ∂(error)/∂(w2) | S49: ∂(error)/∂(w3) | T49: Learning rate | U49: New w1 | V49: New w2 | W49: New w3
B50: of:=[.B41] -> 0 | C50: of:=[.C41] -> 0 | D50: of:=[.D41] -> 0 | E50: of:=[.U43] -> 0.354958179407052 | F50: of:=[.C47] -> 0.440973475997363 | G50: of:=[.D47] -> 0.213474971575283 | H50: of:=[.E47] -> 1 | I50: of:=([.E50]*[.B50])+([.F50]*[.C50])+([.G50]*[.H50]) -> 0.213474971575283 | J50: of:=1/(1+EXP(-1*[.I50])) -> 0.553166987520154 | K50: of:=0.5*([.D50]-[.J50])*([.D50]-[.J50]) -> 0.152996858041061 | L50: of:=[.J50]-[.D50] -> 0.553166987520154 | M50: of:=[.J50]*(1-[.J50]) -> 0.247173271438032 | N50: of:=[.B50] -> 0 | O50: of:=[.C50] -> 0 | P50: of:=[.H50] -> 1 | Q50: of:=[.L50]*[.M50]*[.N50] -> 0 | R50: of:=[.L50]*[.M50]*[.O50] -> 0 | S50: of:=[.L50]*[.M50]*[.P50] -> 0.136728093956877 | T50: of:=[.F47] -> 0.5 | W50: of:=[.G50]-([.T50]*[.S50]) -> 0.145110924596844
B51: of:=[.B42] -> 0 | C51: of:=[.C42] -> 1 | D51: of:=[.D42] -> 1 | E51: of:=[.E50] -> 0.354958179407052 | F51: of:=[.F50] -> 0.440973475997363 | G51: of:=[.G50] -> 0.213474971575283 | H51: of:=[.H50] -> 1 | I51: of:=([.E51]*[.B51])+([.F51]*[.C51])+([.G51]*[.H51]) -> 0.654448447572645 | J51: of:=1/(1+EXP(-1*[.I51])) -> 0.658012208843197 | K51: of:=0.5*([.D51]-[.J51])*([.D51]-[.J51]) -> 0.0584778246501547 | L51: of:=[.J51]-[.D51] -> -0.341987791156803 | M51: of:=[.J51]*(1-[.J51]) -> 0.225032141856494 | N51: of:=[.B51] -> 0 | O51: of:=[.C51] -> 1 | P51: of:=[.H51] -> 1 | Q51: of:=[.L51]*[.M51]*[.N51] -> -0 | R51: of:=[.L51]*[.M51]*[.O51] -> -0.0769582451327868 | S51: of:=[.S50] -> 0.136728093956877 | T51: of:=[.T50] -> 0.5 | V51: of:=[.F51]-([.T51]*[.R51]) -> 0.479452598563756
B52: of:=[.B43] -> 1 | C52: of:=[.C43] -> 0 | D52: of:=[.D43] -> 1 | E52: of:=[.E51] -> 0.354958179407052 | F52: of:=[.F51] -> 0.440973475997363 | G52: of:=[.G51] -> 0.213474971575283 | H52: of:=[.H51] -> 1 | I52: of:=([.E52]*[.B52])+([.F52]*[.C52])+([.G52]*[.H52]) -> 0.568433150982334 | J52: of:=1/(1+EXP(-1*[.I52])) -> 0.638401554365101 | K52: of:=0.5*([.D52]-[.J52])*([.D52]-[.J52]) -> 0.0653767179427873 | L52: of:=[.J52]-[.D52] -> -0.361598445634898 | M52: of:=[.J52]*(1-[.J52]) -> 0.230845009749324 | N52: of:=[.B52] -> 1 | O52: of:=[.C52] -> 0 | P52: of:=[.H52] -> 1 | Q52: of:=[.L52]*[.M52]*[.N52] -> -0.0834731967079285 | R52: of:=[.L52]*[.M52]*[.O52] -> -0 | S52: of:=[.S51] -> 0.136728093956877 | T52: of:=[.T51] -> 0.5 | U52: of:=[.E52]-([.T52]*[.Q52]) -> 0.396694777761016
B53: of:=[.B44] -> 1 | C53: of:=[.C44] -> 1 | D53: of:=[.D44] -> 1 | E53: of:=[.E52] -> 0.354958179407052 | F53: of:=[.F52] -> 0.440973475997363 | G53: of:=[.G52] -> 0.213474971575283 | H53: of:=[.H52] -> 1 | I53: of:=([.E53]*[.B53])+([.F53]*[.C53])+([.G53]*[.H53]) -> 1.0094066269797 | J53: of:=1/(1+EXP(-1*[.I53])) -> 0.732904009128387 | K53: of:=0.5*([.D53]-[.J53])*([.D53]-[.J53]) -> 0.0356701341698444 | L53: of:=[.J53]-[.D53] -> -0.267095990871613 | M53: of:=[.J53]*(1-[.J53]) -> 0.195755722531924 | N53: of:=[.B53] -> 1 | O53: of:=[.C53] -> 1 | P53: of:=[.H53] -> 1 | Q53: of:=[.L53]*[.M53]*[.N53] -> -0.0522855686784529 | R53: of:=[.L53]*[.M53]*[.O53] -> -0.0522855686784529 | S53: of:=[.S52] -> 0.136728093956877 | T53: of:=[.T52] -> 0.5
A55: Iteration 6 | B55: w1 | C55: w2 | D55: w3 | E55: bias | F55: Learning rate | K55: MSE calculated
B56: of:=[.U52] -> 0.396694777761016 | C56: of:=[.V51] -> 0.479452598563756 | D56: of:=[.W50] -> 0.145110924596844 | E56: 1 | F56: of:=[.F47] -> 0.5 | K56: of:=SUM([.K59:.K62]) -> 0.307255484437574
B58: A | C58: B | D58: Target O | E58: w1 | F58: w2 | G58: w3 | H58: bias | I58: Input Agg | J58: Predicted O | K58: MSE term | L58: ∂(error)/∂(O) | M58: ∂(O)/∂(in) | N58: ∂(in)/∂(w1) | O58: ∂(in)/∂(w2) | P58: ∂(in)/∂(w2) | Q58: ∂(error)/∂(w1) | R58: ∂(error)/∂(w2) | S58: ∂(error)/∂(w3) | T58: Learning rate | U58: New w1 | V58: New w2 | W58: New w3
B59: of:=[.B50] -> 0 | C59: of:=[.C50] -> 0 | D59: of:=[.D50] -> 0 | E59: of:=[.U52] -> 0.396694777761016 | F59: of:=[.C56] -> 0.479452598563756 | G59: of:=[.D56] -> 0.145110924596844 | H59: of:=[.E56] -> 1 | I59: of:=([.E59]*[.B59])+([.F59]*[.C59])+([.G59]*[.H59]) -> 0.145110924596844 | J59: of:=1/(1+EXP(-1*[.I59])) -> 0.536214206017652 | K59: of:=0.5*([.D59]-[.J59])*([.D59]-[.J59]) -> 0.14376283736757 | L59: of:=[.J59]-[.D59] -> 0.536214206017652 | M59: of:=[.J59]*(1-[.J59]) -> 0.248688531282511 | N59: of:=[.B59] -> 0 | O59: of:=[.C59] -> 0 | P59: of:=[.H59] -> 1 | Q59: of:=[.L59]*[.M59]*[.N59] -> 0 | R59: of:=[.L59]*[.M59]*[.O59] -> 0 | S59: of:=[.L59]*[.M59]*[.P59] -> 0.133350323347348 | T59: of:=[.F56] -> 0.5 | W59: of:=[.G59]-([.T59]*[.S59]) -> 0.0784357629231701
B60: of:=[.B51] -> 0 | C60: of:=[.C51] -> 1 | D60: of:=[.D51] -> 1 | E60: of:=[.E59] -> 0.396694777761016 | F60: of:=[.F59] -> 0.479452598563756 | G60: of:=[.G59] -> 0.145110924596844 | H60: of:=[.H59] -> 1 | I60: of:=([.E60]*[.B60])+([.F60]*[.C60])+([.G60]*[.H60]) -> 0.6245635231606 | J60: of:=1/(1+EXP(-1*[.I60])) -> 0.651255737849397 | K60: of:=0.5*([.D60]-[.J60])*([.D60]-[.J60]) -> 0.0608112801914843 | L60: of:=[.J60]-[.D60] -> -0.348744262150603 | M60: of:=[.J60]*(1-[.J60]) -> 0.227121701767635 | N60: of:=[.B60] -> 0 | O60: of:=[.C60] -> 1 | P60: of:=[.H60] -> 1 | Q60: of:=[.L60]*[.M60]*[.N60] -> -0 | R60: of:=[.L60]*[.M60]*[.O60] -> -0.0792073903013431 | S60: of:=[.S59] -> 0.133350323347348 | T60: of:=[.T59] -> 0.5 | V60: of:=[.F60]-([.T60]*[.R60]) -> 0.519056293714428
B61: of:=[.B52] -> 1 | C61: of:=[.C52] -> 0 | D61: of:=[.D52] -> 1 | E61: of:=[.E60] -> 0.396694777761016 | F61: of:=[.F60] -> 0.479452598563756 | G61: of:=[.G60] -> 0.145110924596844 | H61: of:=[.H60] -> 1 | I61: of:=([.E61]*[.B61])+([.F61]*[.C61])+([.G61]*[.H61]) -> 0.54180570235786 | J61: of:=1/(1+EXP(-1*[.I61])) -> 0.632232370056992 | K61: of:=0.5*([.D61]-[.J61])*([.D61]-[.J61]) -> 0.0676265148169485 | L61: of:=[.J61]-[.D61] -> -0.367767629943007 | M61: of:=[.J61]*(1-[.J61]) -> 0.232514600309111 | N61: of:=[.B61] -> 1 | O61: of:=[.C61] -> 0 | P61: of:=[.H61] -> 1 | Q61: of:=[.L61]*[.M61]*[.N61] -> -0.0855113434828273 | R61: of:=[.L61]*[.M61]*[.O61] -> -0 | S61: of:=[.S60] -> 0.133350323347348 | T61: of:=[.T60] -> 0.5 | U61: of:=[.E61]-([.T61]*[.Q61]) -> 0.43945044950243
B62: of:=[.B53] -> 1 | C62: of:=[.C53] -> 1 | D62: of:=[.D53] -> 1 | E62: of:=[.E61] -> 0.396694777761016 | F62: of:=[.F61] -> 0.479452598563756 | G62: of:=[.G61] -> 0.145110924596844 | H62: of:=[.H61] -> 1 | I62: of:=([.E62]*[.B62])+([.F62]*[.C62])+([.G62]*[.H62]) -> 1.02125830092162 | J62: of:=1/(1+EXP(-1*[.I62])) -> 0.735217628753079 | K62: of:=0.5*([.D62]-[.J62])*([.D62]-[.J62]) -> 0.0350548520615711 | L62: of:=[.J62]-[.D62] -> -0.264782371246921 | M62: of:=[.J62]*(1-[.J62]) -> 0.194672667123779 | N62: of:=[.B62] -> 1 | O62: of:=[.C62] -> 1 | P62: of:=[.H62] -> 1 | Q62: of:=[.L62]*[.M62]*[.N62] -> -0.0515458904179966 | R62: of:=[.L62]*[.M62]*[.O62] -> -0.0515458904179966 | S62: of:=[.S61] -> 0.133350323347348 | T62: of:=[.T61] -> 0.5
A64: Iteration 7 | B64: w1 | C64: w2 | D64: w3 | E64: bias | F64: Learning rate | K64: MSE calculated
B65: of:=[.U61] -> 0.43945044950243 | C65: of:=[.V60] -> 0.519056293714428 | D65: of:=[.W59] -> 0.0784357629231701 | E65: 1 | F65: of:=[.F56] -> 0.5 | K65: of:=SUM([.K68:.K71]) -> 0.301922653077004
B67: A | C67: B | D67: Target O | E67: w1 | F67: w2 | G67: w3 | H67: bias | I67: Input Agg | J67: Predicted O | K67: MSE term | L67: ∂(error)/∂(O) | M67: ∂(O)/∂(in) | N67: ∂(in)/∂(w1) | O67: ∂(in)/∂(w2) | P67: ∂(in)/∂(w2) | Q67: ∂(error)/∂(w1) | R67: ∂(error)/∂(w2) | S67: ∂(error)/∂(w3) | T67: Learning rate | U67: New w1 | V67: New w2 | W67: New w3
B68: of:=[.B59] -> 0 | C68: of:=[.C59] -> 0 | D68: of:=[.D59] -> 0 | E68: of:=[.U61] -> 0.43945044950243 | F68: of:=[.C65] -> 0.519056293714428 | G68: of:=[.D65] -> 0.0784357629231701 | H68: of:=[.E65] -> 1 | I68: of:=([.E68]*[.B68])+([.F68]*[.C68])+([.G68]*[.H68]) -> 0.0784357629231701 | J68: of:=1/(1+EXP(-1*[.I68])) -> 0.519598893785512 | K68: of:=0.5*([.D68]-[.J68])*([.D68]-[.J68]) -> 0.134991505211564 | L68: of:=[.J68]-[.D68] -> 0.519598893785512 | M68: of:=[.J68]*(1-[.J68]) -> 0.249615883362384 | N68: of:=[.B68] -> 0 | O68: of:=[.C68] -> 0 | P68: of:=[.H68] -> 1 | Q68: of:=[.L68]*[.M68]*[.N68] -> 0 | R68: of:=[.L68]*[.M68]*[.O68] -> 0 | S68: of:=[.L68]*[.M68]*[.P68] -> 0.129700136866388 | T68: of:=[.F65] -> 0.5 | W68: of:=[.G68]-([.T68]*[.S68]) -> 0.013585694489976
B69: of:=[.B60] -> 0 | C69: of:=[.C60] -> 1 | D69: of:=[.D60] -> 1 | E69: of:=[.E68] -> 0.43945044950243 | F69: of:=[.F68] -> 0.519056293714428 | G69: of:=[.G68] -> 0.0784357629231701 | H69: of:=[.H68] -> 1 | I69: of:=([.E69]*[.B69])+([.F69]*[.C69])+([.G69]*[.H69]) -> 0.597492056637598 | J69: of:=1/(1+EXP(-1*[.I69])) -> 0.645082318933099 | K69: of:=0.5*([.D69]-[.J69])*([.D69]-[.J69]) -> 0.0629832801669534 | L69: of:=[.J69]-[.D69] -> -0.354917681066901 | M69: of:=[.J69]*(1-[.J69]) -> 0.228951120732995 | N69: of:=[.B69] -> 0 | O69: of:=[.C69] -> 1 | P69: of:=[.H69] -> 1 | Q69: of:=[.L69]*[.M69]*[.N69] -> -0 | R69: of:=[.L69]*[.M69]*[.O69] -> -0.0812588008482227 | S69: of:=[.S68] -> 0.129700136866388 | T69: of:=[.T68] -> 0.5 | V69: of:=[.F69]-([.T69]*[.R69]) -> 0.559685694138539
B70: of:=[.B61] -> 1 | C70: of:=[.C61] -> 0 | D70: of:=[.D61] -> 1 | E70: of:=[.E69] -> 0.43945044950243 | F70: of:=[.F69] -> 0.519056293714428 | G70: of:=[.G69] -> 0.0784357629231701 | H70: of:=[.H69] -> 1 | I70: of:=([.E70]*[.B70])+([.F70]*[.C70])+([.G70]*[.H70]) -> 0.5178862124256 | J70: of:=1/(1+EXP(-1*[.I70])) -> 0.62665335938719 | K70: of:=0.5*([.D70]-[.J70])*([.D70]-[.J70]) -> 0.0696938570284353 | L70: of:=[.J70]-[.D70] -> -0.37334664061281 | M70: of:=[.J70]*(1-[.J70]) -> 0.233958926555939 | N70: of:=[.B70] -> 1 | O70: of:=[.C70] -> 0 | P70: of:=[.H70] -> 1 | Q70: of:=[.L70]*[.M70]*[.N70] -> -0.087347779271039 | R70: of:=[.L70]*[.M70]*[.O70] -> -0 | S70: of:=[.S69] -> 0.129700136866388 | T70: of:=[.T69] -> 0.5 | U70: of:=[.E70]-([.T70]*[.Q70]) -> 0.483124339137949
B71: of:=[.B62] -> 1 | C71: of:=[.C62] -> 1 | D71: of:=[.D62] -> 1 | E71: of:=[.E70] -> 0.43945044950243 | F71: of:=[.F70] -> 0.519056293714428 | G71: of:=[.G70] -> 0.0784357629231701 | H71: of:=[.H70] -> 1 | I71: of:=([.E71]*[.B71])+([.F71]*[.C71])+([.G71]*[.H71]) -> 1.03694250614003 | J71: of:=1/(1+EXP(-1*[.I71])) -> 0.738259629899965 | K71: of:=0.5*([.D71]-[.J71])*([.D71]-[.J71]) -> 0.0342540106700516 | L71: of:=[.J71]-[.D71] -> -0.261740370100035 | M71: of:=[.J71]*(1-[.J71]) -> 0.193232348759932 | N71: of:=[.B71] -> 1 | O71: of:=[.C71] -> 1 | P71: of:=[.H71] -> 1 | Q71: of:=[.L71]*[.M71]*[.N71] -> -0.0505767064797235 | R71: of:=[.L71]*[.M71]*[.O71] -> -0.0505767064797235 | S71: of:=[.S70] -> 0.129700136866388 | T71: of:=[.T70] -> 0.5
A73: Iteration 8 | B73: w1 | C73: w2 | D73: w3 | E73: bias | F73: Learning rate | K73: MSE calculated
B74: of:=[.U70] -> 0.483124339137949 | C74: of:=[.V69] -> 0.559685694138539 | D74: of:=[.W68] -> 0.013585694489976 | E74: 1 | F74: of:=[.F65] -> 0.5 | K74: of:=SUM([.K77:.K80]) -> 0.296520194286408
B76: A | C76: B | D76: Target O | E76: w1 | F76: w2 | G76: w3 | H76: bias | I76: Input Agg | J76: Predicted O | K76: MSE term | L76: ∂(error)/∂(O) | M76: ∂(O)/∂(in) | N76: ∂(in)/∂(w1) | O76: ∂(in)/∂(w2) | P76: ∂(in)/∂(w2) | Q76: ∂(error)/∂(w1) | R76: ∂(error)/∂(w2) | S76: ∂(error)/∂(w3) | T76: Learning rate | U76: New w1 | V76: New w2 | W76: New w3
B77: of:=[.B68] -> 0 | C77: of:=[.C68] -> 0 | D77: of:=[.D68] -> 0 | E77: of:=[.U70] -> 0.483124339137949 | F77: of:=[.C74] -> 0.559685694138539 | G77: of:=[.D74] -> 0.013585694489976 | H77: of:=[.E74] -> 1 | I77: of:=([.E77]*[.B77])+([.F77]*[.C77])+([.G77]*[.H77]) -> 0.013585694489976 | J77: of:=1/(1+EXP(-1*[.I77])) -> 0.503396371383323 | K77: of:=0.5*([.D77]-[.J77])*([.D77]-[.J77]) -> 0.126703953360948 | L77: of:=[.J77]-[.D77] -> 0.503396371383323 | M77: of:=[.J77]*(1-[.J77]) -> 0.249988464661427 | N77: of:=[.B77] -> 0 | O77: of:=[.C77] -> 0 | P77: of:=[.H77] -> 1 | Q77: of:=[.L77]*[.M77]*[.N77] -> 0 | R77: of:=[.L77]*[.M77]*[.O77] -> 0 | S77: of:=[.L77]*[.M77]*[.P77] -> 0.12584328599825 | T77: of:=[.F74] -> 0.5 | W77: of:=[.G77]-([.T77]*[.S77]) -> -0.049335948509149
B78: of:=[.B69] -> 0 | C78: of:=[.C69] -> 1 | D78: of:=[.D69] -> 1 | E78: of:=[.E77] -> 0.483124339137949 | F78: of:=[.F77] -> 0.559685694138539 | G78: of:=[.G77] -> 0.013585694489976 | H78: of:=[.H77] -> 1 | I78: of:=([.E78]*[.B78])+([.F78]*[.C78])+([.G78]*[.H78]) -> 0.573271388628515 | J78: of:=1/(1+EXP(-1*[.I78])) -> 0.6395176878196 | K78: of:=0.5*([.D78]-[.J78])*([.D78]-[.J78]) -> 0.0649737486974635 | L78: of:=[.J78]-[.D78] -> -0.3604823121804 | M78: of:=[.J78]*(1-[.J78]) -> 0.230534814785473 | N78: of:=[.B78] -> 0 | O78: of:=[.C78] -> 1 | P78: of:=[.H78] -> 1 | Q78: of:=[.L78]*[.M78]*[.N78] -> -0 | R78: of:=[.L78]*[.M78]*[.O78] -> -0.0831037230719473 | S78: of:=[.S77] -> 0.12584328599825 | T78: of:=[.T77] -> 0.5 | V78: of:=[.F78]-([.T78]*[.R78]) -> 0.601237555674513
B79: of:=[.B70] -> 1 | C79: of:=[.C70] -> 0 | D79: of:=[.D70] -> 1 | E79: of:=[.E78] -> 0.483124339137949 | F79: of:=[.F78] -> 0.559685694138539 | G79: of:=[.G78] -> 0.013585694489976 | H79: of:=[.H78] -> 1 | I79: of:=([.E79]*[.B79])+([.F79]*[.C79])+([.G79]*[.H79]) -> 0.496710033627925 | J79: of:=1/(1+EXP(-1*[.I79])) -> 0.621685865969906 | K79: of:=0.5*([.D79]-[.J79])*([.D79]-[.J79]) -> 0.0715607920034699 | L79: of:=[.J79]-[.D79] -> -0.378314134030094 | M79: of:=[.J79]*(1-[.J79]) -> 0.235192550023154 | N79: of:=[.B79] -> 1 | O79: of:=[.C79] -> 0 | P79: of:=[.H79] -> 1 | Q79: of:=[.L79]*[.M79]*[.N79] -> -0.0889766658923391 | R79: of:=[.L79]*[.M79]*[.O79] -> -0 | S79: of:=[.S78] -> 0.12584328599825 | T79: of:=[.T78] -> 0.5 | U79: of:=[.E79]-([.T79]*[.Q79]) -> 0.527612672084119
B80: of:=[.B71] -> 1 | C80: of:=[.C71] -> 1 | D80: of:=[.D71] -> 1 | E80: of:=[.E79] -> 0.483124339137949 | F80: of:=[.F79] -> 0.559685694138539 | G80: of:=[.G79] -> 0.013585694489976 | H80: of:=[.H79] -> 1 | I80: of:=([.E80]*[.B80])+([.F80]*[.C80])+([.G80]*[.H80]) -> 1.05639572776646 | J80: of:=1/(1+EXP(-1*[.I80])) -> 0.742001161923058 | K80: of:=0.5*([.D80]-[.J80])*([.D80]-[.J80]) -> 0.033281700224526 | L80: of:=[.J80]-[.D80] -> -0.257998838076942 | M80: of:=[.J80]*(1-[.J80]) -> 0.19143543762789 | N80: of:=[.B80] -> 1 | O80: of:=[.C80] -> 1 | P80: of:=[.H80] -> 1 | Q80: of:=[.L80]*[.M80]*[.N80] -> -0.0493901204747464 | R80: of:=[.L80]*[.M80]*[.O80] -> -0.0493901204747464 | S80: of:=[.S79] -> 0.12584328599825 | T80: of:=[.T79] -> 0.5
A82: Iteration 9 | B82: w1 | C82: w2 | D82: w3 | E82: bias | F82: Learning rate | K82: MSE calculated
B83: of:=[.U79] -> 0.527612672084119 | C83: of:=[.V78] -> 0.601237555674513 | D83: of:=[.W77] -> -0.049335948509149 | E83: 1 | F83: of:=[.F74] -> 0.5 | K83: of:=SUM([.K86:.K89]) -> 0.291047362006044
B85: A | C85: B | D85: Target O | E85: w1 | F85: w2 | G85: w3 | H85: bias | I85: Input Agg | J85: Predicted O | K85: MSE term | L85: ∂(error)/∂(O) | M85: ∂(O)/∂(in) | N85: ∂(in)/∂(w1) | O85: ∂(in)/∂(w2) | P85: ∂(in)/∂(w2) | Q85: ∂(error)/∂(w1) | R85: ∂(error)/∂(w2) | S85: ∂(error)/∂(w3) | T85: Learning rate | U85: New w1 | V85: New w2 | W85: New w3
B86: of:=[.B77] -> 0 | C86: of:=[.C77] -> 0 | D86: of:=[.D77] -> 0 | E86: of:=[.U79] -> 0.527612672084119 | F86: of:=[.C83] -> 0.601237555674513 | G86: of:=[.D83] -> -0.049335948509149 | H86: of:=[.E83] -> 1 | I86: of:=([.E86]*[.B86])+([.F86]*[.C86])+([.G86]*[.H86]) -> -0.049335948509149 | J86: of:=1/(1+EXP(-1*[.I86])) -> 0.487668514044455 | K86: of:=0.5*([.D86]-[.J86])*([.D86]-[.J86]) -> 0.118910289795163 | L86: of:=[.J86]-[.D86] -> 0.487668514044455 | M86: of:=[.J86]*(1-[.J86]) -> 0.249847934454128 | N86: of:=[.B86] -> 0 | O86: of:=[.C86] -> 0 | P86: of:=[.H86] -> 1 | Q86: of:=[.L86]*[.M86]*[.N86] -> 0 | R86: of:=[.L86]*[.M86]*[.O86] -> 0 | S86: of:=[.L86]*[.M86]*[.P86] -> 0.121842970932321 | T86: of:=[.F83] -> 0.5 | W86: of:=[.G86]-([.T86]*[.S86]) -> -0.11025743397531
B87: of:=[.B78] -> 0 | C87: of:=[.C78] -> 1 | D87: of:=[.D78] -> 1 | E87: of:=[.E86] -> 0.527612672084119 | F87: of:=[.F86] -> 0.601237555674513 | G87: of:=[.G86] -> -0.049335948509149 | H87: of:=[.H86] -> 1 | I87: of:=([.E87]*[.B87])+([.F87]*[.C87])+([.G87]*[.H87]) -> 0.551901607165364 | J87: of:=1/(1+EXP(-1*[.I87])) -> 0.63457666576831 | K87: of:=0.5*([.D87]-[.J87])*([.D87]-[.J87]) -> 0.0667671066005027 | L87: of:=[.J87]-[.D87] -> -0.36542333423169 | M87: of:=[.J87]*(1-[.J87]) -> 0.231889121030685 | N87: of:=[.B87] -> 0 | O87: of:=[.C87] -> 1 | P87: of:=[.H87] -> 1 | Q87: of:=[.L87]*[.M87]*[.N87] -> -0 | R87: of:=[.L87]*[.M87]*[.O87] -> -0.0847376957790886 | S87: of:=[.S86] -> 0.121842970932321 | T87: of:=[.T86] -> 0.5 | V87: of:=[.F87]-([.T87]*[.R87]) -> 0.643606403564057
B88: of:=[.B79] -> 1 | C88: of:=[.C79] -> 0 | D88: of:=[.D79] -> 1 | E88: of:=[.E87] -> 0.527612672084119 | F88: of:=[.F87] -> 0.601237555674513 | G88: of:=[.G87] -> -0.049335948509149 | H88: of:=[.H87] -> 1 | I88: of:=([.E88]*[.B88])+([.F88]*[.C88])+([.G88]*[.H88]) -> 0.47827672357497 | J88: of:=1/(1+EXP(-1*[.I88])) -> 0.617340865649485 | K88: of:=0.5*([.D88]-[.J88])*([.D88]-[.J88]) -> 0.0732140065509427 | L88: of:=[.J88]-[.D88] -> -0.382659134350515 | M88: of:=[.J88]*(1-[.J88]) -> 0.23623112124863 | N88: of:=[.B88] -> 1 | O88: of:=[.C88] -> 0 | P88: of:=[.H88] -> 1 | Q88: of:=[.L88]*[.M88]*[.N88] -> -0.0903959963636521 | R88: of:=[.L88]*[.M88]*[.O88] -> -0 | S88: of:=[.S87] -> 0.121842970932321 | T88: of:=[.T87] -> 0.5 | U88: of:=[.E88]-([.T88]*[.Q88]) -> 0.572810670265945
B89: of:=[.B80] -> 1 | C89: of:=[.C80] -> 1 | D89: of:=[.D80] -> 1 | E89: of:=[.E88] -> 0.527612672084119 | F89: of:=[.F88] -> 0.601237555674513 | G89: of:=[.G88] -> -0.049335948509149 | H89: of:=[.H88] -> 1 | I89: of:=([.E89]*[.B89])+([.F89]*[.C89])+([.G89]*[.H89]) -> 1.07951427924948 | J89: of:=1/(1+EXP(-1*[.I89])) -> 0.746402054190356 | K89: of:=0.5*([.D89]-[.J89])*([.D89]-[.J89]) -> 0.0321559590594357 | L89: of:=[.J89]-[.D89] -> -0.253597945809644 | M89: of:=[.J89]*(1-[.J89]) -> 0.189286027690773 | N89: of:=[.B89] -> 1 | O89: of:=[.C89] -> 1 | P89: of:=[.H89] -> 1 | Q89: of:=[.L89]*[.M89]*[.N89] -> -0.0480025477928475 | R89: of:=[.L89]*[.M89]*[.O89] -> -0.0480025477928475 | S89: of:=[.S88] -> 0.121842970932321 | T89: of:=[.T88] -> 0.5
A91: Iteration 10 | B91: w1 | C91: w2 | D91: w3 | E91: bias | F91: Learning rate | K91: MSE calculated
B92: of:=[.U88] -> 0.572810670265945 | C92: of:=[.V87] -> 0.643606403564057 | D92: of:=[.W86] -> -0.11025743397531 | E92: 1 | F92: of:=[.F83] -> 0.5 | K92: of:=SUM([.K95:.K98]) -> 0.285506050243172
B94: A | C94: B | D94: Target O | E94: w1 | F94: w2 | G94: w3 | H94: bias | I94: Input Agg | J94: Predicted O | K94: MSE term | L94: ∂(error)/∂(O) | M94: ∂(O)/∂(in) | N94: ∂(in)/∂(w1) | O94: ∂(in)/∂(w2) | P94: ∂(in)/∂(w2) | Q94: ∂(error)/∂(w1) | R94: ∂(error)/∂(w2) | S94: ∂(error)/∂(w3) | T94: Learning rate | U94: New w1 | V94: New w2 | W94: New w3
B95: of:=[.B86] -> 0 | C95: of:=[.C86] -> 0 | D95: of:=[.D86] -> 0 | E95: of:=[.U88] -> 0.572810670265945 | F95: of:=[.C92] -> 0.643606403564057 | G95: of:=[.D92] -> -0.11025743397531 | H95: of:=[.E92] -> 1 | I95: of:=([.E95]*[.B95])+([.F95]*[.C95])+([.G95]*[.H95]) -> -0.11025743397531 | J95: of:=1/(1+EXP(-1*[.I95])) -> 0.472463531908221 | K95: of:=0.5*([.D95]-[.J95])*([.D95]-[.J95]) -> 0.111610894491595 | L95: of:=[.J95]-[.D95] -> 0.472463531908221 | M95: of:=[.J95]*(1-[.J95]) -> 0.24924174292503 | N95: of:=[.B95] -> 0 | O95: of:=[.C95] -> 0 | P95: of:=[.H95] -> 1 | Q95: of:=[.L95]*[.M95]*[.N95] -> 0 | R95: of:=[.L95]*[.M95]*[.O95] -> 0 | S95: of:=[.L95]*[.M95]*[.P95] -> 0.117757634161321 | T95: of:=[.F92] -> 0.5 | W95: of:=[.G95]-([.T95]*[.S95]) -> -0.16913625105597
B96: of:=[.B87] -> 0 | C96: of:=[.C87] -> 1 | D96: of:=[.D87] -> 1 | E96: of:=[.E95] -> 0.572810670265945 | F96: of:=[.F95] -> 0.643606403564057 | G96: of:=[.G95] -> -0.11025743397531 | H96: of:=[.H95] -> 1 | I96: of:=([.E96]*[.B96])+([.F96]*[.C96])+([.G96]*[.H96]) -> 0.533348969588748 | J96: of:=1/(1+EXP(-1*[.I96])) -> 0.630263866662491 | K96: of:=0.5*([.D96]-[.J96])*([.D96]-[.J96]) -> 0.0683524041476862 | L96: of:=[.J96]-[.D96] -> -0.369736133337509 | M96: of:=[.J96]*(1-[.J96]) -> 0.233031325042137 | N96: of:=[.B96] -> 0 | O96: of:=[.C96] -> 1 | P96: of:=[.H96] -> 1 | Q96: of:=[.L96]*[.M96]*[.N96] -> -0 | R96: of:=[.L96]*[.M96]*[.O96] -> -0.086160101067596 | S96: of:=[.S95] -> 0.117757634161321 | T96: of:=[.T95] -> 0.5 | V96: of:=[.F96]-([.T96]*[.R96]) -> 0.686686454097855
B97: of:=[.B88] -> 1 | C97: of:=[.C88] -> 0 | D97: of:=[.D88] -> 1 | E97: of:=[.E96] -> 0.572810670265945 | F97: of:=[.F96] -> 0.643606403564057 | G97: of:=[.G96] -> -0.11025743397531 | H97: of:=[.H96] -> 1 | I97: of:=([.E97]*[.B97])+([.F97]*[.C97])+([.G97]*[.H97]) -> 0.462553236290635 | J97: of:=1/(1+EXP(-1*[.I97])) -> 0.613619699703285 | K97: of:=0.5*([.D97]-[.J97])*([.D97]-[.J97]) -> 0.07464486822869 | L97: of:=[.J97]-[.D97] -> -0.386380300296715 | M97: of:=[.J97]*(1-[.J97]) -> 0.237090563839335 | N97: of:=[.B97] -> 1 | O97: of:=[.C97] -> 0 | P97: of:=[.H97] -> 1 | Q97: of:=[.L97]*[.M97]*[.N97] -> -0.09160712325376 | R97: of:=[.L97]*[.M97]*[.O97] -> -0 | S97: of:=[.S96] -> 0.117757634161321 | T97: of:=[.T96] -> 0.5 | U97: of:=[.E97]-([.T97]*[.Q97]) -> 0.618614231892825
B98: of:=[.B89] -> 1 | C98: of:=[.C89] -> 1 | D98: of:=[.D89] -> 1 | E98: of:=[.E97] -> 0.572810670265945 | F98: of:=[.F97] -> 0.643606403564057 | G98: of:=[.G97] -> -0.11025743397531 | H98: of:=[.H97] -> 1 | I98: of:=([.E98]*[.B98])+([.F98]*[.C98])+([.G98]*[.H98]) -> 1.10615963985469 | J98: of:=1/(1+EXP(-1*[.I98])) -> 0.751412456566299 | K98: of:=0.5*([.D98]-[.J98])*([.D98]-[.J98]) -> 0.030897883375201 | L98: of:=[.J98]-[.D98] -> -0.248587543433701 | M98: of:=[.J98]*(1-[.J98]) -> 0.186791776683299 | N98: of:=[.B98] -> 1 | O98: of:=[.C98] -> 1 | P98: of:=[.H98] -> 1 | Q98: of:=[.L98]*[.M98]*[.N98] -> -0.0464341088993176 | R98: of:=[.L98]*[.M98]*[.O98] -> -0.0464341088993176 | S98: of:=[.S97] -> 0.117757634161321 | T98: of:=[.T97] -> 0.5